G1,G2,rater1,rater2
Search for specific information or messages,Enable seamless and secure data transfer,NONE,NONE
Provide professional and relevant content experience,Get feedback from interviewees about company hiring processes,REFINED_BY,REFINES
Utilize job search functionalities,Use profile for job applications,NONE,REFINES
Upload a video or start a stream.,Publish a video after uploading it,REFINES,REFINES
Optimize user decision-making based on weather information.,Consider transportation options based on temperature.,REFINED_BY,REFINED_BY
Ensure data integrity and user privacy,Send a message to a colleague,NONE,REFINES
Improve coding proficiency overall,Participate in weekly contests for practice,REFINED_BY,REFINED_BY
Enhance user retention through personalized content and seamless navigation,Navigate with a smooth user experience,EQUIV,REFINED_BY
Secure the best flight experience,Save time by being familiar with the application’s user interface,NONE,NONE
Explore detailed radar maps for weather information.,Share unusual weather updates on social media.,REFINES,REFINES
Increase interaction quality between users,Send a personalized note with connection requests,REFINED_BY,REFINED_BY
Avoid being logged in to maintain privacy,Make sure flight details work for the schedule,NONE,NONE
Enable viewers to subscribe to content creators,Search using vague criteria to find meaningful results,NONE,REFINES
Facilitate organization of diverse content types,Save educational resources for future reference.,NONE,REFINED_BY
Avoid cycling when it's very cold.,Provide general weather update upon opening the application.,REFINES,NONE
Centralize communication features into a single application.,Communicate with peers and professors instantly,NONE,REFINES
Make informed clothing decisions based on weather forecasts.,Ensure safety by preparing for adverse weather conditions.,REFINES,REFINED_BY
Upload a video or start a stream.,Facilitate user-friendly content discovery through advanced search features,NONE,NONE
Enhance coding abilities through structured practice,Prepare better for job interviews by practicing.,REFINES,REFINES
Scroll through a personalized newsfeed,Scroll through topics of interest,EQUIV,REFINES
Enhanced data privacy controls,Accept data being shared with other parties,REFINED_BY,REFINES
Find a good deal when booking flights,Compare multiple booking platforms simultaneously,REFINED_BY,REFINED_BY
Blacklist irrelevant job postings,Track the application status or employer responsiveness.,NONE,NONE
Prepare better for job interviews by practicing.,Practice using similar questions linked by category,REFINED_BY,REFINED_BY
Search for video content visually,Provide enhanced search and discovery features for user engagement.,REFINES,REFINES
Find a good deal when booking flights,Make sure flight details work for the schedule,REFINED_BY,NONE
Upload a video or start a stream.,Publish a video after uploading it,REFINES,REFINES
Expand content diversity to attract wide user demographics,Watch personalized content recommendations,NONE,NONE
Maintain user privacy while personalizing content.,Accept data being shared with other parties,REFINED_BY,REFINES
Facilitate Real-time and Asynchronous Communication,Communicate with peers and professors instantly,REFINED_BY,REFINES
Store books in online accounts,Read downloaded PDFs on a tablet,NONE,NONE
Ensure user privacy and security for job applications function,Keep application details private and avoid exposure to unintended parties.,REFINED_BY,REFINES
Access saved job listings,Access saved jobs,EQUIV,NONE
Use a music streaming feature made for discovering new songs,Discover new songs similar to ones heard online.,REFINES,REFINES
Enhance user decision-making with detailed weather data.,Adjust travel plans based on weather conditions.,REFINED_BY,REFINED BY
Manage professional identity,Access saved jobs,NONE,NONE
Organize reading materials effectively,Have a place to consolidate all reading materials,REFINED_BY,REFINED BY
Improve job search experience,View number of people entering the hiring process,NONE,REFINED BY
Communicate with friends and family,Backup and restore messages when changing phones,REFINED_BY,NONE
Receive job recommendations,Enhance user engagement with content,REFINES,NONE
Enhance search functionality to identify suitable professional contacts,Consider purchasing a premium membership to expand search capabilities,NONE,REFINED BY
Participate in weekly contests for practice,Explore new algorithms,NONE,REFINES
Postpone activities in case of extreme weather conditions.,Check weather forecasts for the entire week for trip planning.,REFINED_BY,NONE
Ensure optimal travel experience,Check direct airline websites for better pricing,NONE,NONE
Facilitate seamless and secure transactions,Scan QR codes for payment transactions,REFINED_BY,NONE
Use profile for job applications,Upload a resume,REFINED_BY,REFINED BY
Facilitate User Engagement with Tailored Content,Search for answers within communities.,REFINED_BY,REFINED BY
Engage with home-page feeds for interesting insights.,Scroll through a personalized newsfeed,REFINES,NONE
Ensure user data privacy and security,Get job updates that match personal skill set.,NONE,NONE
Receive job updates specific to domain and skill set,Enhance personalization and relevance of job matches,REFINES,REFINES
Facilitate social sharing and personalization,Create and use personal playlists,REFINED BY,REFINED BY
Provide comprehensive weather forecasting,Explore detailed radar maps for weather information.,REFINED_BY,REFINED BY
Expand professional network,Manage professional identity,NONE,NONE
Increase the number of connections on a professional networking platform,Improve connection request success rate,REFINED_BY,REFINED BY
Read content online,Have a place to consolidate all reading materials,NONE,NONE
Find good itineraries and pricing through research,Accommodate comparison of alternative routes and services,REFINED_BY,REFINED BY
Access saved job listings,Filter jobs by job titles or locations,NONE,NONE
Access saved job listings,Apply filters to job searches,NONE,NONE
Enhance Travel Convenience,Check connections with other modes of transport,NONE,NONE
Support various listening scenarios and contexts,Use a music streaming feature made for discovering new songs,REFINED_BY,REFINED BY
Personalize Job Search Experience,"Filter job listings based on role, company, and location.",REFINED_BY,REFINED BY
Utilize job search functionalities,Manage alert frequency,NONE,REFINED BY
Increase the number of connections on a professional networking platform,Enhance search functionality to identify suitable professional contacts,REFINED_BY,REFINED BY
Receive job notifications unless they complicate the notification tab,Receive job postings instantly when they are posted,REFINES,REFINES
Connect with known individuals,Enhance user engagement with content,NONE,NONE
Review application details,Submit job applications,REFINES,REFINES
Optimize user interface for effective job search,"Consider employee reviews, current work tasks, and tech stack in job postings.",REFINED_BY,NONE
Read news online,Access and read educational materials from a school portal.,NONE,NONE
Utilize weather forecasts to enhance activity planning.,Plan daily attire based on weather information,REFINED_BY,REFINES
Make video or audio calls more easily,Make the call feature more accessible,REFINED_BY,REFINED BY
Find good itineraries and pricing through research,Make sure flight details work for the schedule,REFINED_BY,REFINED BY
Time oneself on solving coding problems,Develop problem-solving and analytical skills through diverse techniques,NONE,NONE
Facilitate efficient content discovery and access,Navigate quickly to continue watching from where I left off,REFINED_BY,REFINED BY
Browse job postings,Enhance job search experience,REFINES,REFINES
Automatically transfer application details to the company's website.,Include a quick apply button on job postings.,REFINED_BY,REFINED BY
Provide comprehensive weather forecasting,Avoid cycling when it's very cold.,NONE,REFINES
Enhance user experience through personalized job recommendations,Track the application status or employer responsiveness.,NONE,NONE
Manage applications and notifications effectively.,"Consider employee reviews, current work tasks, and tech stack in job postings.",NONE,NONE
Enhance job search efficiency through personalized features,"Filter job listings based on role, company, and location.",REFINED_BY,REFINED BY
Enable personalized job search experiences,Define and match necessary skill set to job postings,REFINED_BY,REFINED BY
Export content easily to a drive or application,Read content online,NONE,NONE
View hourly weather details for planning daily activities.,Maintain flexibility in planning based on weather conditions,REFINES,REFINED BY
Navigate quickly to continue watching from where I left off,Support diverse media formats,NONE,NONE
Save time by being familiar with the application’s user interface,Ensure the flight booking is convenient,NONE,NONE
Organize reading materials effectively,Store books in online accounts,REFINED_BY,NONE
Ensure users can easily discover and access content,Enhance user engagement with personalized features,REFINES,REFINES
Have a place to consolidate all reading materials,Categorize reading material by time,REFINED_BY,NONE
Ensure high-quality user experience in content playback,Search for video content visually,REFINED_BY,REFINED BY
Receive frequent notifications about rain in real time.,Plan trips using weather forecasts.,REFINES,REFINES
Avoid being contacted by random people from other platforms.,Ensure Efficient Application Process,NONE,NONE
Receive job updates via professional emails.,Efficiently manage user-job interactions to improve engagement,REFINES,REFINES
Set job preferences,Indicate open to work status,REFINED_BY,REFINED BY
Prefer job postings matching criteria using AI features for identification.,Save or organize interesting job postings for later,NONE,NONE
Participate in weekly contests for practice,Participate in coding contests to improve reading and transformation skills.,REFINES,EQUIV
Time oneself on solving coding problems,Enhance coding abilities through structured practice,REFINES,NONE
Solve a specific problem through search,Seek technical help or input on a problem,REFINES,REFINES
Receive important international event updates.,Receive recommendations based on browsing history.,NONE,NONE
Centralize Communication and Information Sharing System,Make video or audio calls more easily,NONE,NONE
Search for a specific post,Get more targeted results for a problem,NONE,NONE
Find good itineraries and pricing through research,Book flights early for better prices,REFINED_BY,REFINED BY
Facilitate content discovery,Search for specific movie titles or shows,REFINED_BY,REFINED BY
Track the application status or employer responsiveness.,Have emails that are concise with necessary details and a direct apply button.,,NONE
Scroll through a personalized newsfeed,Scroll through topics of interest,,EQUIV
Stay updated with the industry,Review application details,,NONE
Enable viewers to subscribe to content creators,Ensure content moderation and policy compliance,,NONE
Manage user preferences,Accept data being shared with other parties,,REFINED BY
Enhance job search experience,Apply filters to job searches,,REFINED BY
Safeguard user privacy and data integrity,Receive job updates via professional emails.,,NONE
Facilitate Daily Planning Based on Weather Information,Check for rain forecasts to decide whether to bring an umbrella.,,REFINES
Increase the number of connections on a professional networking platform,Encourage platform investments to unlock advanced features,,NONE
Ensure Portability and Interoperability,Store books in online accounts,,NONE
Find good itineraries and pricing through research,Look out for better deals over weeks or days,,REFINED BY
Explore job opportunities,Indicate open to work status,,REFINED BY
Filter jobs by job titles or locations,Manage job application process,,NONE
Increase the number of connections on a professional networking platform,Utilize professional connections for career advancement,,REFINES
Save time by being familiar with the application’s user interface,Try to find the best price for a flight itinerary,,NONE
Maintain user privacy while accessing weather information.,Look for temperature and chance of rain when first opening the weather information.,,NONE
Find authentic answers to queries,Learn more about a particular topic,,REFINES
Improve content discovery and accessibility,Provide 24-hour notice before streaming begins,,NONE
Use a quick email feature to communicate formally,Reach a wide audience immediately using channels.,,FLASE
Connect with someone new,Add a personal message to connection requests,,REFINED BY
Research further on something interesting,Search for answers within communities.,,REFINED BY
Use weather information to determine if it's suitable for outdoor activities.,Look for temperature and chance of rain when first opening the weather information.,,REFINED BY
Submit job applications,Check news feed,,NONE
Avoid being contacted by random people from other platforms.,Keep application details private and avoid exposure to unintended parties.,,REFINED BY
Receive job updates specific to domain and skill set,Customize job search with keywords and roles,,REFINES
Support personalized audio session,Search for songs based on emotions or keywords,,REFINES
Manage applications and notifications effectively.,Navigate information about the tech stack more easily.,,NONE
Receive content on a machine seamlessly,Access content without interruptions,,REFINES
Enhance user engagement with platform features,Watch personalized content recommendations,,REFINED BY
Maintain user privacy through application settings,Set alerts for price changes on certain routes.,,NONE
Receive job notifications unless they complicate the notification tab,Ensure user privacy and security for job applications function,,NONE
Connect with people for job referrals when necessary.,Enhance application efficiency and tracking,,NONE
Enhance application efficiency and tracking,Enable personalized job search experiences,,REFINES
Enhance job search experience,Access saved jobs,,REFINED BY
Improve problem-solving skills,Discuss difficult problems with friends to understand the solution better.,,NONE
Enhance collaborative problem-solving skills,Practice coding skills to improve daily work performance,,NONE
Prevent some viewers from seeing unsuitable content.,"Provide a premium, uninterrupted viewing experience",,NONE
Read content online,Read news online,,REFINED BY
Enhance user experience through premium offerings,Search for people using a company name and school name,,REFINED BY
Facilitate User Engagement with Tailored Content,Scroll through topics of interest,,NONE
Use multiple communication tools together efficiently,Integrate communication tools into a single platform,,REFINED BY
Scan QR codes for payment transactions,Facilitate user-friendly interaction,,REFINES
Provide an Integrated Reading Experience,Save educational resources for future reference.,,NONE
Improve user engagement with personalized features,Search for people using a company name and school name,,NONE
Ensure the security and appropriateness of shared content,Enable viewers to subscribe to content creators,,NONE
Increase the number of connections on a professional networking platform,Filter potential connections based on employment status,,NONE
Explore new algorithms,Facilitate collaborative learning and problem-solving.,,NONE
Research new workouts by gathering personal insights,Improve overall user experience through personalization,,REFINES
Engage with home-page feeds for interesting insights.,Scroll through a personalized newsfeed,,REFINES
View and Interact with Personalized Content,Browse subreddits without a specific outcome,,REFINES
Integrate and Synchronize Communication Tools,Make video or audio calls more easily,,REFINES
Browse daily information,Scroll through general information,,REFINES
Enable seamless file and data management,Scan QR codes for payment transactions,,NONE
Navigate information about the tech stack more easily.,"Consider employee reviews, current work tasks, and tech stack in job postings.",,REFINES
Maintain seamless user experience across devices.,Enable full screen mode for video playback,,REFINED BY
Manage applications and notifications effectively.,Receive job updates specific to domain and skill set,,REFINED BY
Enhance the effectiveness of connecting with relevant professionals,Send a personalized note with connection requests,,REFINED BY
Like a post,Connect with known individuals,,REFINES
Prefer to manage privacy by limiting location data in browser cache,Use weather information to determine if it's suitable for outdoor activities.,,NONE
Enhance user decision-making with detailed weather data.,View hourly weather details for planning daily activities.,,REFINED BY
Facilitate secure and efficient communication,Transfer large files without file size limitations,,REFINED BY
Reduce the presence of marketing accounts in content feeds,Address and handle matrix accounts to reduce irrelevant content,,REFINED BY
Search for answers within communities.,Find authentic answers to queries,,REFINES
Use a music streaming feature made for discovering new songs,Discover new songs similar to ones heard online.,,REFINES
Deliver timely and relevant weather information,Receive weather updates three times a day,,REFINED BY
Improve strategic approach to coding challenges,Discuss difficult problems with friends to understand the solution better.,,NONE
Provide professional and relevant content experience,Search for job posting information,,NONE
Provide an engaging content discovery experience,Explore new content types like games introduced on the platform,,REFINED BY
Maintain updated health and wellness knowledge through online resources,Search for general health information.,,REFINES
Scroll through topics of interest,Scroll through a personalized newsfeed,,EQUIV
Enhance Reader Engagement,See percentage of chapter read,,REFINED BY
Explore ways to make interface elements easier to navigate.,Switch the temperature unit display from Fahrenheit to Celsius.,,NONE
Manage alert frequency,Facilitate Connection Building,,NONE
Use a quick email feature to communicate formally,Communicate with peers and professors instantly,,REFINES
Enhance job search effectiveness,Apply filters to job searches,,REFINED BY
Access content without interruptions,Optimize streaming performance and reduce latency.,,REFINED BY
Find authentic answers to queries,Search for answers within communities.,,REFINED BY
Enhance privacy and personalized booking experience,Avoid being logged in to maintain privacy,,REFINED BY
Upload a resume,Use profile for job applications,,NONE
Plan a trip.,Use weather information for decision-making,,REFINED BY
Update job seeking status,Enhance job search effectiveness,,REFINES
Receive job notifications unless they complicate the notification tab,Save or organize interesting job postings for later,,NONE
Read content online,Store books in online accounts,,REFINED BY
Provide enhanced search and discovery features for user engagement.,Access content without interruptions by subscribing to a premium tier,,NONE
Facilitate user-friendly content discovery through advanced search features,Enable full screen mode for video playback,,NONE
Facilitate user-generated content engagement,Find authentic answers to queries,,NONE
Facilitate integration with user's daily routine,Listen to ambient noise,,REFINES
Edit personal profile,Manage job application process,,NONE
Apply filters to job searches,Filter jobs by job titles or locations,,REFINED BY
Provide comprehensive weather data to support user decision-making.,Review weather alerts and warnings from local authorities or government organizations.,,REFINED BY
Enhance job search efficiency through personalized features,Ensure timely and efficient job application process,,NONE
Avoid being logged in to maintain privacy,Find good itineraries and pricing through research,,NONE
Ensure content suitability via automated and manual review processes.,Upload a video or start a stream.,,NONE
Seek technical help or input on a problem,View and Interact with Personalized Content,,NONE
Receive important international event updates.,Not miss out on important information,,REFINES
Enable personalized job search experiences,Customize job search with keywords and roles,,REFINES
Facilitate instantaneous and seamless communication,Reach a wide audience immediately using channels.,,REFINED BY
Track overall reading progress,Save educational resources for future reference.,,REFINED BY
Join relevant groups,Enhance job search effectiveness,,NONE
Access saved job listings,Access saved jobs,,EQUIV
Enhance job search efficiency through personalized features,Blacklist irrelevant job postings,,NONE
Receive job updates specific to domain and skill set,Prefer job postings matching criteria using AI features for identification.,,REFINED BY
Manage user preferences,Search for information based on a specific region,,REFINED BY
Facilitate organization of diverse content types,Read news online,,NONE
Enable seamless data communication and continuity,Transfer files to friends,,REFINED BY
Facilitate Professional Growth Opportunities,Send a personalized note with connection requests,,REFINED BY
Increase the number of connections on a professional networking platform,Leverage connections for professional opportunities,,REFINES
Enhance user experience through intuitive design,Navigate with a smooth user experience,,REFINED BY
Search using vague criteria to find meaningful results,Enhance user engagement and discovery,,REFINES
Search for personal experiences over facts,Research new workouts by gathering personal insights,,REFINED BY
Manage applications and notifications effectively.,Save or organize interesting job postings for later,,REFINED BY
Filter out entertainment content from professional content,Exclude entertainment content when searching for job or housing information,,REFINES
Ensure timely and efficient job application process,Automatically transfer application details to the company's website.,,REFINED BY
Browse subreddits without a specific outcome,Support Open Exploration and Specific Problem Solving,,REFINES
Expand professional network,Connect with known individuals,,REFINED BY
Review weather alerts and warnings from local authorities or government organizations.,Use weather information to determine if it's suitable for outdoor activities.,,REFINES
Add a personal message to connection requests,Connect with known individuals,,REFINES
Categorize reading material by time,Provide offline access to previously accessed content,,NONE
Consider transportation options based on temperature.,Facilitate decision-making for daily life based on weather.,,REFINES
Explore new algorithms,Finish all questions in a specific category.,,NONE
Read something interesting,Read personal reviews before making purchasing decisions.,,REFINED BY
Refine search strategies for specific queries,Search for a specific post,,REFINES
Discuss difficult problems with friends to understand the solution better.,Adopt a strategic practice approach.,,NONE
Maximize booking efficiency,Find good itineraries and pricing through research,,REFINED BY
Adjust travel plans based on weather conditions.,Consider transportation options based on temperature.,,REFINED BY
Reach a wide audience immediately using channels.,Accessible and integrated communication system,,NONE
Use weather information to determine if it's suitable for outdoor activities.,Facilitate Daily Planning with Weather Information,,REFINES
Utilize job search functionalities,Submit job applications,,NONE
Ensure integration with existing travel preferences,Make sure flight details work for the schedule,,REFINED BY
Include a quick apply button on job postings.,Automatically transfer application details to the company's website.,,REFINES
Filter jobs by job titles or locations,Indicate open to work status,,NONE
View hourly weather details for planning daily activities.,Look for temperature and chance of rain when first opening the weather information.,,NONE
Obtain referrals from current employees for positions at a company,Enhance the effectiveness of connecting with relevant professionals,,NONE
Access content without interruptions,Stream data smoothly without interruptions,,REFINED BY
Read news online,Integrate with educational and standard reading formats,,NONE
Enhance the effectiveness of connecting with relevant professionals,Consider purchasing a premium membership to expand search capabilities,,NONE
Receive job recommendations,Add a personal message to connection requests,,REFINED BY
Enhance user’s music experience,Use a music streaming feature made for discovering new songs,,REFINED BY
Engage with network,Join relevant groups,,REFINED BY
Browse job postings,Submit job applications,,REFINES
Switch the temperature unit display from Fahrenheit to Celsius.,Check the temperature the day before to plan clothing,,NONE
Provide comprehensive weather forecasting,Share unusual weather updates on social media.,,NONE
Scroll through general information,Browse daily information,,NONE
Share unusual weather updates on social media.,Facilitate Daily Planning with Weather Information,,NONE
Provide comprehensive weather data to support user decision-making.,Explore detailed radar maps for weather information.,,REFINED BY
